[
 {
  "id": "gartner-strategic-predictions-2004-001",
  "source_edition_id": "gartner-strategic-predictions-2004",
  "quote": "By 2009, counterfeit reality will account for at least one major media and political scandal",
  "position": "top prediction null",
  "subject_ids": [
   "counterfeit-reality-fabricated-media"
  ],
  "claim_type": "forecast",
  "target_date": "2009",
  "hedge": "by",
  "note": "Secondary source: a blog post (January 25, 2005) quoting the Gartner research note. The Gartner text was not seen directly. Extraction confidence: medium.",
  "status": "open",
  "published": true
 },
 {
  "id": "gartner-strategic-predictions-2004-002",
  "source_edition_id": "gartner-strategic-predictions-2004",
  "quote": "Cyberattacks against software flaws will double by 2006",
  "position": "top prediction null",
  "subject_ids": [
   "cyberattacks-on-software-flaws"
  ],
  "claim_type": "forecast",
  "metric": "change in cyberattacks against software flaws",
  "value": "2",
  "unit": "x (double)",
  "target_date": "2006",
  "hedge": "by",
  "note": "Secondary source: a blog post (January 25, 2005) quoting the Gartner research note. The Gartner text was not seen directly. Extraction confidence: medium.",
  "status": "open",
  "published": true
 },
 {
  "id": "gartner-strategic-predictions-2004-003",
  "source_edition_id": "gartner-strategic-predictions-2004",
  "quote": "By 2007, three of the top 10 PC vendors will exit the market",
  "position": "top prediction null",
  "subject_ids": [
   "pc-vendor-market-exits"
  ],
  "claim_type": "forecast",
  "metric": "number of top 10 PC vendors exiting the market",
  "value": "3",
  "unit": "count",
  "target_date": "2007",
  "hedge": "by",
  "note": "Secondary source: a blog post (January 25, 2005) quoting the Gartner research note. The Gartner text was not seen directly. Extraction confidence: medium.",
  "status": "open",
  "published": true
 },
 {
  "id": "gartner-strategic-predictions-2004-004",
  "source_edition_id": "gartner-strategic-predictions-2004",
  "quote": "By 2008, the technological differences between PCs, mobile devices, e-books, TVs and cellular phones will be eradicated",
  "position": "top prediction null",
  "subject_ids": [
   "device-convergence"
  ],
  "claim_type": "forecast",
  "target_date": "2008",
  "hedge": "by",
  "note": "Secondary source: a blog post (January 25, 2005) quoting the Gartner research note. The Gartner text was not seen directly. Extraction confidence: medium.",
  "status": "open",
  "published": true
 },
 {
  "id": "gartner-strategic-predictions-2004-005",
  "source_edition_id": "gartner-strategic-predictions-2004",
  "quote": "By 2015, 40% of today's IT job roles will be lost to automation",
  "position": "top prediction null",
  "subject_ids": [
   "automation-of-it-jobs"
  ],
  "claim_type": "forecast",
  "metric": "share of IT job roles lost to automation",
  "value": "40",
  "unit": "%",
  "target_date": "2015",
  "hedge": "by",
  "note": "Secondary source: a blog post (January 25, 2005) quoting the Gartner research note. The Gartner text was not seen directly. Extraction confidence: medium.",
  "status": "open",
  "published": true
 },
 {
  "id": "gartner-strategic-predictions-2006-001",
  "source_edition_id": "gartner-strategic-predictions-2006",
  "quote": "Through 2009, market share for the top 10 IT outsourcers will decline to 40.0% (from 43.5% now), equaling a revenue shift of $5.4 billion.",
  "position": "top prediction 1",
  "subject_ids": [
   "it-outsourcing-market-concentration"
  ],
  "claim_type": "forecast",
  "metric": "top 10 IT outsourcers' market share",
  "value": "40.0",
  "unit": "%",
  "target_date": "2009",
  "hedge": "through",
  "note": "From 43.5% at time of writing; revenue shift of $5.4 billion.",
  "status": "open",
  "published": true
 },
 {
  "id": "gartner-strategic-predictions-2006-002",
  "source_edition_id": "gartner-strategic-predictions-2006",
  "quote": "Only one Asia/Pacific-based service provider will make the global top 20 through 2010.",
  "position": "top prediction 2",
  "subject_ids": [
   "asia-pacific-it-service-providers"
  ],
  "claim_type": "forecast",
  "metric": "Asia/Pacific-based providers in global top 20",
  "value": "1",
  "unit": "count",
  "target_date": "2010",
  "hedge": "through",
  "status": "open",
  "published": true
 },
 {
  "id": "gartner-strategic-predictions-2006-003",
  "source_edition_id": "gartner-strategic-predictions-2006",
  "quote": "Blogging and community contributors will peak in the first half of 2007.",
  "position": "top prediction 3",
  "subject_ids": [
   "blogging"
  ],
  "claim_type": "forecast",
  "target_date": "2007",
  "hedge": "in",
  "note": "Peak of blogging and community contributors in the first half of 2007.",
  "status": "open",
  "published": true
 },
 {
  "id": "gartner-strategic-predictions-2006-004",
  "source_edition_id": "gartner-strategic-predictions-2006",
  "quote": "By 2009, corporate social responsibility (CSR) will be a higher board- and executive-level priority than regulatory compliance.",
  "position": "top prediction 4",
  "subject_ids": [
   "corporate-social-responsibility"
  ],
  "claim_type": "forecast",
  "target_date": "2009",
  "hedge": "by",
  "status": "open",
  "published": true
 },
 {
  "id": "gartner-strategic-predictions-2006-005",
  "source_edition_id": "gartner-strategic-predictions-2006",
  "quote": "By the end of 2007, 75% of enterprises will be infected with undetected, financially motivated, targeted malware that evaded their traditional perimeter and host defenses.",
  "position": "top prediction 5",
  "subject_ids": [
   "targeted-malware"
  ],
  "claim_type": "forecast",
  "metric": "share of enterprises infected with undetected targeted malware",
  "value": "75",
  "unit": "%",
  "target_date": "2007",
  "hedge": "by the end of",
  "status": "open",
  "published": true
 },
 {
  "id": "gartner-strategic-predictions-2006-006",
  "source_edition_id": "gartner-strategic-predictions-2006",
  "quote": "Vista will be the last major release of Microsoft Windows.",
  "position": "top prediction 6",
  "subject_ids": [
   "microsoft-windows-release-model"
  ],
  "claim_type": "forecast",
  "note": "No target year stated. No target year stated.",
  "status": "open",
  "published": true
 },
 {
  "id": "gartner-strategic-predictions-2006-007",
  "source_edition_id": "gartner-strategic-predictions-2006",
  "quote": "By 2010, the average total cost of ownership (TCO) of new PCs will fall by 50%.",
  "position": "top prediction 7",
  "subject_ids": [
   "pc-total-cost-of-ownership"
  ],
  "claim_type": "forecast",
  "metric": "reduction in average TCO of new PCs",
  "value": "50",
  "unit": "%",
  "target_date": "2010",
  "hedge": "by",
  "status": "open",
  "published": true
 },
 {
  "id": "gartner-strategic-predictions-2006-008",
  "source_edition_id": "gartner-strategic-predictions-2006",
  "quote": "By 2010, 60% of the worldwide cellular population will be “trackable” via an emerging “follow-me Internet.”",
  "position": "top prediction 8",
  "subject_ids": [
   "mobile-phone-location-tracking"
  ],
  "claim_type": "forecast",
  "metric": "share of worldwide cellular population trackable",
  "value": "60",
  "unit": "%",
  "target_date": "2010",
  "hedge": "by",
  "status": "open",
  "published": true
 },
 {
  "id": "gartner-strategic-predictions-2006-009",
  "source_edition_id": "gartner-strategic-predictions-2006",
  "quote": "Through 2011, enterprises will waste $100 billion buying the wrong networking technologies and services.",
  "position": "top prediction 9",
  "subject_ids": [
   "networking-technology-spending-waste"
  ],
  "claim_type": "forecast",
  "metric": "wasted spending on wrong networking technologies",
  "value": "100",
  "unit": "USD billion",
  "target_date": "2011",
  "hedge": "through",
  "status": "open",
  "published": true
 },
 {
  "id": "gartner-strategic-predictions-2006-010",
  "source_edition_id": "gartner-strategic-predictions-2006",
  "quote": "By 2008, nearly 50% of data centers worldwide will lack the necessary power and cooling capacity to support high-density equipment.",
  "position": "top prediction 10",
  "subject_ids": [
   "data-center-power-and-cooling"
  ],
  "claim_type": "forecast",
  "metric": "share of data centers lacking power and cooling capacity",
  "value": "50",
  "unit": "% (nearly)",
  "target_date": "2008",
  "hedge": "by",
  "status": "open",
  "published": true
 },
 {
  "id": "gartner-strategic-predictions-2008-001",
  "source_edition_id": "gartner-strategic-predictions-2008",
  "quote": "By 2011, Apple will double its U.S. and Western Europe unit market share in Computers.",
  "position": "top prediction 1",
  "subject_ids": [
   "apple-computer-market-share"
  ],
  "claim_type": "forecast",
  "metric": "change in Apple U.S. and Western Europe computer unit share",
  "value": "2",
  "unit": "x (double)",
  "target_date": "2011",
  "hedge": "by",
  "status": "open",
  "published": true
 },
 {
  "id": "gartner-strategic-predictions-2008-002",
  "source_edition_id": "gartner-strategic-predictions-2008",
  "quote": "By 2012, 50 per cent of traveling workers will leave their notebooks at home in favour of other devices.",
  "position": "top prediction 2",
  "subject_ids": [
   "notebooks-left-at-home-by-travelers"
  ],
  "claim_type": "forecast",
  "metric": "share of traveling workers leaving notebooks at home",
  "value": "50",
  "unit": "%",
  "target_date": "2012",
  "hedge": "by",
  "status": "open",
  "published": true
 },
 {
  "id": "gartner-strategic-predictions-2008-003",
  "source_edition_id": "gartner-strategic-predictions-2008",
  "quote": "By 2012, 80 per cent of all commercial software will include elements of open-source technology.",
  "position": "top prediction 3",
  "subject_ids": [
   "open-source-in-commercial-software"
  ],
  "claim_type": "forecast",